{"schema_version":"mindclade.feature-requirement-set/v1","kind":"FeatureRequirementSet","metadata":{"uid":"requirements-model-001","created_at":"2026-08-31T12:00:00Z","producer":"model-registry","classification":"INTERNAL"},"spec":{"consumer":{"uri":"artifacts/models/model-001","digest":"sha256:aaaaaaaaaaaaaaaaaaaaaaaaaaaaaaaaaaaaaaaaaaaaaaaaaaaaaaaaaaaaaaaa","media_type":"application/schema+json","schema_version":"mindclade.model-manifest/v1"},"requirements":[{"feature_contract":{"uri":"artifacts/features/confidence-v1","digest":"sha256:bbbbbbbbbbbbbbbbbbbbbbbbbbbbbbbbbbbbbbbbbbbbbbbbbbbbbbbbbbbbbbbb","media_type":"application/schema+json","schema_version":"mindclade.feature-contract/v1"},"compatibility":"EXACT"}],"compatibility_policy":"FAIL_CLOSED"},"lineage":[{"uri":"artifacts/models/model-001","digest":"sha256:aaaaaaaaaaaaaaaaaaaaaaaaaaaaaaaaaaaaaaaaaaaaaaaaaaaaaaaaaaaaaaaa","media_type":"application/schema+json","schema_version":"mindclade.model-manifest/v1"}],"integrity":{"payload_digest":"sha256:cccccccccccccccccccccccccccccccccccccccccccccccccccccccccccccccc","evidence":[]}}
